36|Au terme de ce parcours, il est possible de dire à la fois vers quel horizon s’oriente toute la chaîne des symboles parcourus et comment les plus archaïques sont retenus et réaffirmés par les plus avancés de ces symboles.
37|On pourrait appeler serf-arbitre le concept vers lequel tend toute la suite des symboles primaires du mal; mais ce concept n’est pas directement accessible; si on tente de lui faire correspondre un objet, cet objet se détruit lui-même, car il met en court-circuit l’idée d’arbitre, qui ne peut signifier que libre choix, donc libre arbitre, toujours intact et jeune, toujours disponible, — et l’idée de servitude, c’est-à-dire l’indisponibilité même de la liberté pour elle-même. Le concept de serf-arbitre ne peut donc être représenté comme celui de faillibilité que nous avons considéré au début de cet ouvrage; car il faudrait pouvoir penser la coïncidence du libre arbitre et de la servitude dans le même existant. C’est pourquoi le concept de serf-arbitre doit rester un concept indirect, qui tire toute sa signification de la symbolique que nous avons parcourue et qui tente d’élever cette symbolique au niveau de la spéculation. Ce concept, qui nous occupera dans le troisième tome de cet ouvrage, ne peut donc être visé que comme l’Idée, le télos intentionnel de toute la symbolique du mal. Encore ne pourra-t-il être approché de plus près que par la médiation des symboles de second rang institués par les mythes du mal.
38|Du moins pouvons-nous dire dès maintenant que le concept de serf-arbitre duquel s’approche l’expérience la plus différenciée, la plus fine, la plus intériorisée de la culpabilité, était déjà visé par la plus archaïque de toutes, celle de la souillure. Le dernier symbolene vise son concept-limite qu’en reprenant en lui toute la richesse des symboles antérieurs. Il y a ainsi une relation circulaire entre tous les symboles : les derniers dégagent le sens de ceux qui les précèdent, mais les premiers prêtent aux derniers toute leur puissance de symbolisation.
39|Il est possible de la montrer en parcourant en sens inverse toute la suite des symboles. Il est remarquable, en efïet, que la culpabilité reprend à son compte le langage symbolique dans lequel se sont constituées les expériences de souillure et de péché.
40|La culpabilité ne peut se dire en effet que dans le langage indirect de la « captivité » et de « l’infection », hérité des deux instances antérieures; l’un et l’autre symbole sont ainsi transposés « vers l'intérieur » pour dire une liberté qui s’asservit elle-même, s’affecte et s’infecte par son propre choix; en retour, le caractère symbolique et non littéral de la captivité du péché et de l’infection de la souillure est rendu entièrement manifeste en désignant désormais une dimension de la liberté elle-même; maintenant et seulement maintenant nous savons que ce sont des symboles lorsqu’ils découvrent une situation qui se concentre dans la relation de soi à soi-même. Pourquoi ce recours à la symbolique antérieure ? Parce que le paradoxe d’un libre arbitre captif — le paradoxe d’un serf-arbitre — est insupportable pour la pensée. Que la liberté soit à délivrer, que cette délivrance soit délivrance du propre esclavage, cela ne peut être dit en style direct : c’est pourtant la thématique centrale du « salut ».
41|Le chiffre de la captivité, emprunté on le sait à la théologie de l’histoire, a d’abord désigné une situation communautaire, celle d’un peuple prisonnier de ses péchés; cette situation communautaire adhère encore à l’événement historique que la liturgie répète, comme ce destin malheureux dont l’Exode a été la délivrance. En devenant chiffre de l’individu coupable, la captivité décolle de la réminiscence historique et accède a la qualité de symbole pur : elle désigne un événement de la liberté.
42|Ce symbolisme est central dans l’expérience juive; mais s’il peut être compris, c’est parce qu’il appartient au moins latéralement à toutes les cultures; l’expérience ou la croyance qui fournit le sens littéral peut être multiple et variée mais la visée du symbole rester la même. Ainsi la représentation des démons comme origine de l’état <rêtre-lié, chez les Babyloniens, fournit le schème initial de la possession; mais cette possession toute corporelle peut a son tour fournir l’image de base à travers laquelle est désignée la servitudedu libre arbitre; on peut suivre la meme image de la possession à des degrés divers de symbolisation; au plus bas degré la possession est représentée comme une emprise physique sur le corps et les membres : « Puisse le mal qui est dans mon corps, dans mes muscles et mes tendons s’en aller aujourd’hui », implore le suppliant de Babylone; « délie-moi de mon charme... parce qu’un mauvais charme et une impure maladie et la transgression et l’iniquité et le péché sont en mon corps et parce qu’un spectre méchant est attaché à moi ». On dira autant qu’on voudra que cette supplication porte encore la marque de la confusion de la maladie et du péché et de ce couple lui-même avec la possession physique par une puissance démoniaque réelle. Mais le processus de symbolisation est sans doute déjà commencé; le suppliant de Babylone se « confesse » et se « repent » : il sait obscurément que ce lien est en quelque façon son œuvre; sinon pourquoi s’écrierait-il : « Les péchés nombreux que depuis ma jeunesse j’ai commis, délic-lcs. Je veux craindre le dieu; l’offense je veux ne point commettre » ? Pourquoi le suppliant demanderait-il à être délié de ce qu’il a commis, s’il ne savait obscurément, s’il ne savait sans savoir, s’il ne savait en énigme et par symbole, qu’il a commis le lien même dont il demande à être délié ?
43|Ce qui nous confirme que le symbolisme du serf-arbitre, bien qu’enfoncé encore et comme noyé dans la lettre des représentations démoniaques, est déjà à l’œuvre dans l’aveu du suppliant de Babylone, c’est que le même symbolisme de l’homme aux membres liés se retrouve chez les écrivains qui ont usé de ce symbole avec une claire conscience que c’était un symbole : ainsi saint Paul sait-il que l’homme est « inexcusable » bien que le péché soit dit « régner » dans les membres, « dans le corps mortel » (Rom., 6, 12), et que le corps lui-même soit dit « corps de péché » (Rom., 6-6) et l’homme entier « asservi au péché ». Si saint Paul ne parlait pas symboliquement du corps de péché comme d’une figure du serf-arbitre, comment pourrait-il s’écrier : « Si vous avez jadis offert vos membres comme esclaves à l’impureté et au désordre de manière à vous désordonner, offrez-les de même aujourd’hui à la justice pour vous sanctifier » (Rom., 6, 19) ? Le symbole du corps asservi, c’est le symbole d’un être pécheur qui est à la fois acte et état, c’est-à-dire d’un être-pécheur dans lequel l’acte même de s’asservir s’abolit comme « acte » et retombe en « état »; le corps est le symbole de cette liberté oblitérée, d’un constitué dont le constituant s’est évacué. Dans le langage de saint Paul, Pacte c’est « l’of-{rende » du corps à la servitude (si jadis vous avez offert vos mem-bres comme esclaves), l’état c’est le règne (que le péché ne règne donc plus dans vos corps mortels) ; une « offrande » de moi-même qui est en même temps un « règne » sur moi-même, voilà l’énigme du serf-arbitre, de l’arbitre qui se rend serf.
44|Enfin, Platon lui-même, malgré le mythe orphique de l’âme exilée dans un corps qui l’ensevelit, malgré par conséquent la tentation de durcir le symbole de la captivité corporelle dans une gnose du corps méchant, malgré même les gages qu’il donne pour l’avenir à cette gnose, sait parfaitement que la captivité corporelle ne doit pas être prise à la lettre, mais comme signe du serf-arbitre; la « clôture » du corps n’est finalement que « l’œuvre du désir » et « celui qui concourt le plus à charger l’enchaîné de scs chaînes, c’est peut-être lui-même » (Phédon, 82 de). Ainsi la captivité du corps et même la captivité de l’âme dans le corps sont le symbole du mal que l’gme s’inflige à elle-même, le symbole de l’affection de la liberté par elle-même; le « déliement » de l’âme assure rétrospectivement que son « liement » était liemcnt par le désir, fascination active-passive, auto-captivité : « se perdre » ne signifie pas autre chose.
45|L’expression dont nous venons d’user — l’affection de la liberté par elle-même — nous conduit à comprendre comment la culpabilité la plus intériorisée peut récapituler tout le symbolisme antérieur, y compris celui de la souillure; elle le reprend à son compte à travers le symbolisme de la captivité. J’oserais même dire que la souillure devient symbole pur, lorsqu’elle ne dit plus du tout une tache réelle, mais signifie seulement le serf-arbitre. Le sens symbolique de la souillure n’est achevé qu’au terme de toutes ses reprises.
46|Je vois dans le symbole pur de la souillure trois intentions qui constituent le triple « schématisme » du serf-arbitre :le symbole de sa propre extériorité; le mal vient à l’homme comme le « dehors » de la liberté, comme l’autre que soi dans lequel elle se prend; « chacun est éprouvé par sa propre convoitise qui l’attire et le leurre » (Jq, 1, 13) ; c’est le schème de la séduction : il signifie que le mal, bien que posé, est déjà là qui attire; cette extériorité est si essentielle au mal humain que l’homme, dit Kant, ne saurait être le méchant absolu, le Mauvais; il est toujours le méchant second, le méchant par séduction; le mal est à la fois « posé » maintenant et toujours déjà là : commencer, c’est continuer; c’est cet être-séduit qui est symbolisé dans l’extériorité d’un contact impur; il est essentiel que le mal soit en quelque manière subi : ce sera le fond de vérité, entre autres erreurs, de toute identification du mal humain à un pathos, à une « passion ». Pour extirper par conséquent le symbole de la souillure, il faudrait éliminer de l’expérience humaine du mal ce schème d’extériorité : on pourra, tant qu’il faudra, démythiser les conceptions magiques de contagion, de contamination; leur survivent les modalités toujours plus subtile· du <( dehors » séduisant, qui appartiennent encore au serf-arbitre à son point le plus extrême d’intériorité.
47|encore en état de comprendre cette intention ultime du symbole de la souillure : elle ne sera dégagée et élaborée que par le moyen des symboles de second rang et principalement par le moyen du mythe de chute; alors on comprendra que le mal n’est pas le symétrique du bien, la méchanceté le substitut de la bonté de l’homme, mais la flétrissure, l’obscurcissement, l’enlaidissement d’une innocence, d’une lumière et d’une beauté qui demeurent. Aussi radical que soit le mal, il ne saurait être aussi originaire que la bonté. Cela, le sym· bole de la souillure le dit déjà du serf-arbitre; et il le dit à travers le symbole de la captivité : car quand un pays tombe intact aux mains de l’ennemi, il continue de travailler, de produire, de créer, d’exister, mais pour l’ennemi; il est responsable, mais son œuvre est aliénée; cette superposition de l’esclavage à la disposition de soi, telle qu’un pays occupé peut en faire l’expérience, suggère l’idée semblable d’une superposition existentielle du mal radical et de la bonté originaire; c’est cette surimpression qui est déjà visée dans le schème de l’infection, où nous proposons de recon· naître Tultime intention du symbole de la souillure. Mais cette intention n’apparaît que quand le monde magique qui a porté le symbole de la souillure s’est effondré, et quand l’expérience du péché s’est elle-même intériorisée en expérience du serf-arbitre. Alors la souillure, devenue langage du serf-arbitre, livre son ultime intention; encore ne livre-t-elle toutes les implications du schème de l’infection qu’à travers toutes les couches symboliques qu’il reste encore à parcourir : symboles mythiques et symboles spéculatifs.
48|Nous avons tenté jusqu’à présent de « répéter » en imagination et en sympathie Γexpérience de la faute. Avons-nous réellement atteint, sous le nom d’expérience, une donnée immédiate? Nullement. Ce qui est vécu comme souillure, comme péché, comme culpabilité requiert la médiation d’un langage spécifique, le langage des symboles. Sans le secours de ce langage, l’expérience demeurerait muette, obscure et fermée sur ses contradictions implicites (ainsi la souillure se dit comme quelque chose qui infecte du dehors et le péché comme une relation brisée et comme une puissance, etc.). Ces symboles élémentaires, à leur tour, n’ont été atteints qu’au prix d’une abstraction qui les a arrachés au riche monde des mythes. Pour tenter une exégèse purement sémantique des expressions les plus révélatrices de l’expérience de la faute (tache et souillure, déviation, révolte, transgression, égarement, etc.) nous avons dû mettre entre parenthèses les symboles du second degré qui médiatisent les symboles primaires qui eux-mêmes médiatisent l’expérience vive de la souillure, du péché, de la culpabilité.
49|Cette nouvelle couche expressive ne laisse pas d’embarrasser l’homme moderne. En un sens lui seul peut reconnaître le mythe comme mythe, parce que lui seul a atteint le point où histoire et mythe se séparent; cette « crise », cette décision, à partir de laquelle mythe et histoire se dissocient, peut signifier la perte de la dimension mythique : parce que le temps du mythe ne peut plus être coordonné au temps des événements « historiques », au sens de la méthode et de la critique historique, parce que l’espace dumythe ne peut plus être coordonné aux lieux de notre géographie, nous sommes tentés de nous livrer à une radicale démythisation de toute notre pensée. Mais une autre possibilité s’offre à nous : précisément parce que nous vivons et pensons après la séparation du mythe et de l’histoire, la démythisation de notre histoire peut devenir l’envers d’une compréhension du mythe comme mythe et la conquête, pour la première fois dans l’histoire de la culture, de la dimension mythique. C’est pourquoi nous ne parlons jamais ici de démythisation, mais à la rigueur de démythologisation, étant bien entendu que ce qui est perdu c’est le pseudo-savoir, le faux logos du mythe, tel qu’il s’exprime par exemple dans la fonction étiologique du mythe. Mais perdre le mythe comme logos immédiat, c’est le retrouver comme mythos. Au prix seulement, et par le détour de l’exégèse et de la compréhension philosophique, le mythos peut susciter une nouvelle péripétie du logos.
50|Cette conquête du mythe comme mythe n’est qu’un aspect de la reconnaissance des symboles et de leur pouvoir révélant. Comprendre le mythe comme mythe, c’est comprendre ce que le mythe, ave son temps, son espace, ses événements, ses personnages, son drame, ajoute à la fonction révélante des symboles primaires élaborés plus haut.
51|Sans prétendre donner ici une théorie générale des symboles et des mythes et en nous bornant volontairement et systématiquement a ce groupe de symboles mythiques qui concernent le mal humain, nous pouvons énoncer en ces termes notre hypothèse de travail que toute la suite de l’analyse doit mettre en œuvre et vérifier par l’exécution même :la faute, le mythe confère à cette expérience une orientation, une allure, une tension. L’cxpéricnce ne se réduit plus à un vécu présent; ce présent n’était qu’une coupe instantanée dans un développement tendu entre une origine et un accomplissement, entre une « Genèse » et une « Apocalypse »; grâce au mythe, l’expérience est traversée par l’histoire essentielle de la perdition et du salut de l’homme.
52|De toutes ces manières le mythe fait de l’expérience de la faute le centre d’une totalité, le centre d’un monde : le monde de la faute.
53|On peut déjà deviner combien nous nous éloignons d’une interprétation purement allégorisante du mythe. L’allégorie est toujours susceptible d’être traduite dans un texte intelligible par lui-même; une fois ce meilleur texte déchiffré, l’allégorie tombe comme un vêtement inutile; ce que l’allégorie montrait en le cachant peut être dit dans un discours direct qui se substitue à elle. Par sa triple fonction d’universalité concrète, d’orientation temporelle et enfin d’exploration ontologique, le mythe a une façon de révéler, irréductible à toute traduction d’un langage chiffré en un langage clair; comme Schelling l’a montré dans sa Philosophie de la Mythologie, le mythe est autonome et immédiat : il signifie ce qu’il dit *. 1 1Il importe donc de procéder à un discernement critique du mythe qui respecte son irréductibilité à l’allégorie.
54|Le discernement critique du mythe exige d’abord que le mythe soit entièrement dégagé de la fonction « étiologique » avec laquelle il paraît se confondre. Cette distinction est fondamentale pour une reprise philosophique du mythe; car la principale objection que la philosophie adresse au mythe, c’est que l’explication mythique est incompatible avec la rationalité découverte ou inventée par les Présocratiques; elle représente désormais le simulacre de la rationalité.
55|Le départage de la rationalité et de son mime est en effet aussi décisif que celui de l’histoire et du mythe; il en est même le fondement : car l’histoire n’est histoire que parce que sa recherche des « causes » s’adosse à l’Épistémé des géomètres et des physiciens, lors même qu’elle s’en distingue. Si donc le mythe peut survivre à ce double départage de l’histoire et du mythe ainsi que de l’explication et du mythe, il faut que le mythe ne soit ni histoire arrivée en un temps et en un lieu déterminés, ni explication.
56|Mon hypothèse de travail c’est que la critique du pseudo-rationnel est fatale non pas au mythe mais à la gnose. C’est dans la gnose que se réalise le simulacre de la raison. Or la gnose c’est ce qui recueille et développe le moment étiologique du mythe. C’est la gnose du mal plus particulièrment qui se tient sur le sol de la raison : comme le mot même le déclare, gnose veut dire « connaissance ». Entre la gnose et la raison il faut choisir. Mais peut-être y a-t-il une manière de répéter le mythe comme mythe, en deçà de son glissement à la gnose, dans la nudité et la pauvreté d’un symbole qui ne serait pas une explication mais une ouverture et une découverte. Tout notre effort va donc tendre à dissocier mythe et gnose.
57|Nous sommes encouragés dans cette tentative par le grand exemple de Platon : Platon insère des mythes dans sa philosophie; il les adopte en tant que mythes, à l’état brut si l’on ose dire, sans essayer de les déguiser en explication; ils sont là, dans le discours, plein d’énigmee; ils sont là en tant que mythes sans confusion possible avec le Savoir.
58|Il est vrai que le mythe est en lui-même invitation à la gnose. Bien plus le problème du mal paraît bien être l’occasion par excel-Ience de ce passage du mythe à la gnose. Nous savons déjà quelle puissance de questionner jaillit de la souffrance et du péché : « Jusques à quand Seigneur ? » « Ai-je péché contre quelque divinité ? » « Mon acte était-il pur ? » On dirait que le problème du mal représente à la fois la plus considérable provocation à penser et l’invitation la plus sournoise à déraisonner; comme si le mal était un problème toujours prématuré où les fins de la raison excèdent toujours ses moyens; bien avant que la nature ait fait délirer la raison et l’ait jetée dans l’illusion transcendantale, la contradiction vécue entre la destination de l’homme, projetée dans l’imagination de l’innocence originaire et de la perfection finale, et la situation effective de l’homme, avouée et confessée, fit surgir un gigantesque « pourquoi ? » au centre de l’épreuve d’exister. Aussi est-ce au voisinage de cette « question » que sont nés les plus grands délires explicatifs qui composent la littérature considérable de la gnose.
59|Qu’est donc le mythe en deçà de sa prétention « étiologique » ? Qu’est donc le mythe s’il n’est pas gnose ? C’est encore une fois à la fonction du symbole que nous sommes renvoyés. Le symbole, avons-nous dit, ouvre et découvre une dimension d’expérience qui, sans lui, resterait fermée et dissimulée. Il faut donc montrer en quel sens le mythe est une fonction de second degré des symboles primaires que nous avons explorés jusqu’à présent.
60|Pour cela il faut retrouver cette fonction d’ouverture et de découverte — que nous opposons ici à la fonction explicative de la gnose — jusque dans les traits les plus spécifiques, qui distinguent le mythe des symboles primaires. Or c’est le récit qui vient ajouter un nouvel étage de signification à celui des symboles primaires.
61|Comment le récit peut-il signifier sur un mode symbolique et non étiologique ?
62|Nous aurons recours ici à l’interprétation que la phénoménologie de la religion, avec Van der Leeuw, Leenhardt, Éliade, propose de la conscience mythique. Au premier abord, cette interprétation paraît dissoudre le mythe-récit dans une conscience indivise qui consiste moins à raconter des histoires, à fabuler, qu’à se rapporter affectivement et pratiquement à l’ensemble des choses. Ce qui nous importe ici c’est de comprendre pourquoi cette conscience, structurée plus bas que tout récit, que toute fable et légende, affleure néanmoins à lu parole sous la forme du récit. Si les phénoménologues de la religion ont été plus soucieux de remonter du récit à laracine pré-narrative du mythe, nous ferons le trajet inverse de la conscience pré-narrative à la narration mythique; c’est en effet dane ce passage que se concentre toute l’énigme de la fonction symbolique du mythe.
63|Il faut en effet rendre compte de deux caractères du mythe : qu’il est une parole et qu’en lui le symbole prend la forme du récit.
64|Portons-nous au-delà du récit : selon la phénoménologie de la religion, le mythe-récit ne serait que l’enveloppe verbale d’une forme de vie, sentie et vécue, avant d’être formulée; cette forme de vie s’exprimerait d’abord dans une conduite globale à l’égard du tout des choses; c’est dans le rite plus que dans le récit que cette conduite s’exprimerait le plus complètement et la parole mythique elle-même serait seulement le segment verbal de cette action totale*. Plus fondamentalement encore, action rituelle et parole mythique, prises conjointement, désigneraient par-delà elles-mêmes un modèle, un archétype, qu’elles imiteraient ou répéteraient; imitation gestuelle, répétition verbale ne seraient que les expressions brisées d’une participation vécue à un Acte originel qui serait l'exemplaire commun du rite et du mythe.
65|Il n’est pas douteux que la phénoménologie de la religion a profondément renouvelé le problème du mythe en remontant ainsi à une structure mythique qui serait la matrice de toutes les figures et de tous les récits déterminés propre à telle ou telle mythologie et en rapportant à cette structure mythique diffuse les catégories fondamentales du mythe : participation, relation au Sacré, etc.
66|Cest cette structure mythique elle-même qui ramène à la diversité des mythes. Quelle est en effet la signification ultime de cette structure mythique ? Elle désignerait, nous dit-on, l’accord intime de l’homme du culte et du mythe avec la totalité de l’être; elle signifierait une plénitude indivisible où le surnaturel, le naturel et le psychologique ne seraient pas encore scindés. Mais comment le mythe signifie-t-il cette plénitude ? Le fait essentiel est que cette intuition d’un englobant cosmique dont l’homme ne serait pas séparé et cette plénitude indivise, antérieure à la scission du 2 2surnaturel, du naturel et de l’humain, ne sont pas donné» mais simplement visées. C’est en intention seulement que le mythe restitue quelque intégrité; c’est parce qu’il a lui-même perdu cette intégrité que l’homme la répète et la mime par le mythe et le rite. L’homme primitif est déjà l’homme de la scission. Dès lors le mythe ne peut être qu’une restauration ou une restitution intentionnelle et, en ce sens déjà, symbolique.
67|Cet écart entre le vécu et l’intentionnel, tous les auteurs qui ont attribué au mythe un rôle biologique de protection contre l’angoisse l’ont reconnu; si la fabulation riposte à la détresse, c’est que l’homme du mythe est déjà conscience malheureuse3; pour lui, l’unité, la conciliation et la réconciliation doivent être dites et agies, précisément parce qu’elles ne sont pas données; la fabulation est originaire, contemporaine de la structure mythique, dès lors que la participation est signifiée plutôt que vécue.
