68|Or en manifestant le caractère seulement symbolique de la relation de l’homme à la totalité perdue, le mythe est dès l’origine condamné à la scission en de multiples cycles. 11 n’existe pas, en effet, de signification qui égale cc qu’elle vise; comme l’étude des symboles primaires de la faute l’a déjà suggéré, c’est toujours à partir d’un quelque chose qui joue le rôle d’analogon que le symbole symbolise; la multiplicité des symboles est la conséquence immédiate de leur servitude à l’égard d’un matériel d’analoga, dont l’ensemble est nécessairement limité en extension et dont chacun est également limité en compréhension.
69|Lévi-Strauss a fortement insiste sur ce décalage initial entre'la limitation de l’expérience et la totalité signifiée par le mythe : « L’Univers, écrit-il4, a signifié bien avant qu’on ne commence à savoir cc qu’il signifiait...; il a signifié dès le début la totalité de ce que l’humanité peut s’attendre à en connaître »; « l’homme dispose dès son origine d’une intégralité du signifiant dont il est fort embar-rassé pour faire l’allocation à un signifié, donné comme tel sans être pourtant connu. » Cette totalité, tellement signifiée et si peu vécue, ne devient disponible qu’en se condensant dans des êtres et dans des objets sacrés qui deviennent les signes privilégiés de ce signifiant total. De là la diversification originaire des symboles; il n’existe en effet nulle part au monde une civilisation où ce surplus de signification serait visé hors de toute forme mythique ou rituelle définie. Le sacré prend forme contingente précisément parce qu’il est « flottant »; aussi ne se laisse-t-il deviner qu’à travers la diversité indéfinie des mythologies et des rituels. L’aspect chaotique et arbitraire du monde des mythes est ainsi la contrepartie exacte de ce décalage entre la plénitude purement symbolique et la finitude de l’expérience qui fournit l’homme en « analogues » du signifié. Il faut alors des récits et des rites pour consacrer le contour des signes du sacré : lieux saipts et objets sacrés, époques et fêtes, sont d’autres aspects de cette contingence que nous retrouvons dans le récit. Si la plénitude était vécue, elle serait partout dans l’espace et dans le temps; mais parce qu’elle est seulement visée symboliquement, elle requiert des signes privilégiés et un discours sur ces signes; leur hétérogénéité atteste le signifiant total par ses affleurements contingents; dès lors le mythe a pour fonction de garder les contours finis de ces signes qui renvoient à leur tour à oette plénitude que l’homme vise plus qu’il ne la vit. C’est pourquoi, bien que les civilisations primitives aient en commun à peu près la même structure mythique, cette structure indifférenciée n’existe nulle part sans une diversité de mythes : la polarité de la structure mythique et des mythes est une suite du caractère symbolique de la totalité et de la plénitude que mythes et rites répètent. Parce qu’il est symbolisé et non vécu le sacré se scinde en mythes multiples.
70|Mais pourquoi le mythe en se scindant prend-il la forme du récit ? Ce qu’il faut comprendre maintenant c’est pourquoi le modèle exemplaire auquel le mythe et le rite font participer affecte lui-même l’allure d’un drame. C’est, en effet, parce que le signifié ultime de tout mythe est lui-même en forme de drame que les récits dans lesquels la conscience mythique se fragmente sont eux-mêmes tissus « d’événements » et de « personnages »; parce que son paradigme est dramatique, le mythe est lui-même événementiel et ne se donne nulle part ailleurs que dans la forme plastique du récit. Mais pourquoi le mythe-récit renvoie-t-il symboliquement à un drame ?
71|C’est que la conscience mythique non seulement ne vit pas laplénitude, mais encore ne la désigne qu’à l’origine ou au terme d’une Histoire fondamentale. La plénitude que le mythe vise sym* boliquement est instaurée, perdue et restaurée dangereusement, douloureusement. Aussi n’est-elle pas donnée : non seulement parce qu’elle est signifiée et non vécue, mais parce qu’elle est signifiée à travers un combat. Le mythe comme d’ailleurs le rite reçoit de ce drame originel la discursivité spéciale du récit. Le caractère plastique, imagé, événementiel du mythe tient donc à la fois à la nécessité de donner des signes contingents d’un Sacré purement symbolique et au caractère dramatique du temps originel; ainsi le temps du mythe est-il dès le début diversifié par le drame originel.
72|Les mythes concernant l’origine et la fin du mal que nous allons maintenant étudier ne constituent qu’un secteur limité de mythes et fournissent seulement une vérification partielle de l’hypothèse de travail qui est exposée dans cette introduction. Du moins nous donnent-ils un accès direct à la structure originellement dramatique du monde des mythes; on se rappelle les trois caractères fondamentaux qui ont été reconnus aux mythes du mal : l’universalité concrète conférée à l’expérience humaine par le moyen de personnages exemplaires, la tension d’une histoire exemplaire orientée d’un Commencement vers une Fin, enfin la transition d’une nature essentielle à une histoire aliénée; ces trois fonctions des mythes du mal sont trois aspects d’une même structure dramatique. Dès lors, la forme du récit n’est ni seconde ni accidentelle, mais primitive et essentielle. Le mythe exerce sa fonction symbolique par le moyen spécifique du récit parce que oe qu’il veut dire est déjà drame. C’est ce drame originel qui ouvre et découvre le sens caché de l’expérience humaine; ce faisant le mythe qui le raconte assume la fonction irremplaçable du récit.
73|Les deux caractères du mythe que nous venons de souligner sont fondamentaux pour notre investigation du monde de la faute.
74|D’abord le surplus de signification, le « signifiant flottant », que le Sacré constitue, atteste que l’expérience de la faute telle que nous l’avons décrite dans la première partie, est dès son origine en relation ou en tension avec une totalité de sens, avec une signification globale de l’univers; cette relation ou cette tension fait partie intégrante de cette expérience; ou plutôt cette expérience ne subsiste qu’en liaison avec des symboles qui replacent la faute dans une totalité non perçue, non vécue, mais signifiée, visée, conjurée; la parole de la confession des péchés n’est dès lors qu’un fragmentd'une parole plus vaste qui désigne mythiquement l’origine et la fin de la faute et la totalité dans laquelle elle a surgi; arracher l’ex-périencc, le vécu, au symbole c’est retirer à cette expérience ce qui en achève le sens; or, c’est le mythe comme récit qui met en rela* tion l’expérience présente de la faute avec la totalité du sens.
75|D’autre part ce sens total sur lequel la faute se détache est lié par la conscience mythique à un drame originel. Les symboles fondamentaux qui imprègnent l’expérience de la faute sont les symboles de la détresse, de la lutte et de la victoire qui, en ce temps-là, ont marqué l’instauration du monde. Totalité de sens et drame cosmique constituent les deux clés qui vont nous servir à ouvrir les mythes du Commencement et de la Fin.
76|Mais si la conscience mythique à travers les civilisations primitives reste à peu près semblable à elle-même et si d’autre part les mythologies sont en nombre illimité, comment nous frayerons-nous un chemin entre l’Un et le Multiple ? Comment éviterons-nous de nous perdre, soit dans une vague phénoménologie de la conscience mythique qui retrouve partout du « Mana » et partout de la répétition et de la participation, soit dans une mythologie comparée indéfiniment diversifiée ? Nous allons tenter de suivre le conseil de Platon dans le Philèbe lorsqu’il enjoint de ne point imiter les « éristiques » qui font « trop vite un et trop vite multiple », mais de chercher toujours un nombre intermédiaire que la « multiplicité réalise dans l’intervalle entre l’Infini et l’Un »; respecter ces intermédiaires, disait Platon, « c’est ce qui distingue dans nos discussions la manière dialectique de la manière éristique ».
77|Cette « multiplicité nombrée », intermédiaire entre une conscience mythique indifférenciée et les mythologies trop différenciées, est à chercher par le moyen d’une « typologie ». Les <c types » que nous proposons sont a la fois des a priori qui permettent d’aller a la rencontre de l’expérience avec une grille de lecture et de s’orienter dans le dédale des mythologies du mal et des a posteriori sans cesse corrigée et redressés au contact de l’expérience. Je penserais volontiers comme Cl. Lévi-Strauss dans Tristes Tropiques que les « figures » que peuvent réaliser l’imagination fabulatrice et l’activité institutionnelle de l’homme ne sont pas en nombreinfini et qu’il est possible d’élaborer, au moins à titre d’hypothèse de travail, une sorte de morphologie de ces figures principales.
78|Nous considérerons ici quatre « types » mythiques de représentation concernant l’origine et la fin du mal.
79|Ainsi la scission qui se produit, avec le second type, entre l’événement irrationnel de la chute et l’antique drame de création provoque une scission parallèle entre le thème du salut qui devient éminemment « historique » et le thème de la création qui recule au rang d’arrière-plan « cosmologique » par rapport au drame temporel déployé sur l’avant-scène du monde; le salut, entendu comme l’ensemble des initiatives de la divinité et du croyant tendant à l’élimination du mal, vise désormais une fin spécifique distincte de la fin de la création; cette fin spécifique, autour de laquelle gravitent les représentations « eschutologiques », ne peut plus être non plus identifiée avec la fin de la création et on arrive à cette étrange tension entre deux représentations : celle d’une créationclose avec le « repos du septième jour », celle d'une entreprise de salut, encore en sursis, en attendant le « Dernier Jour ». Sur toute la ligne le décollement de la problématique du mal par rapport à celle de la création se poursuit à partir de l’idée d’une chute « survenue » dans une création parfaite. C’est donc l’événement » même de la chute qui porte tout le poids de cette mythique, comme la pointe d’une pyramide renversée.
80|Entre le chaos du drame de création, la faute inévitable du héros tragique et la chute de l’homme primitif se nouent des relations complexes d’exclusion et d’inclusion que nous essaierons de comprendre et de reprendre en nous-mêmes; mais même la relation d’exclusion survient à l’intérieur d’un espace commun, grâce auquel ces trois mythes ont un destin solidaire.
81|que les affinités secrètes du mythe biblique de chute le portent plutôt vers le mythe de chaos et vers le mythe tragique que vers le mythe de l’âme exilée.
82|Ainsi la « typologie » ne doit pas être cantonnée dans une entreprise de classification; cette statique doit se dépasser dans une dynamique qui a pour tâche de découvrir la vie latente des mythes et le jeu de leurs affinités secrètes. C’est cette dynamique qui doit préparer une « reprise » philosophique du mythe.
